{
  "schema_version": "1.0.0",
  "contract": "contracts/darkstar-release/v1/contract.json",
  "contract_version": "1.0.0",
  "family": "qwen3.8-27b",
  "family_display": "Darkstar Qwen3.8-27B",
  "source_revision": "Qwen/Qwen3.8-27B@1d4bf0f2ff6012fd82039f2fa52739d0dd7c60c0",
  "note": "Machine-readable source of truth for the Darkstar four-cell release process. Base BF16 is the unchanged upstream Qwen/Qwen3.8-27B reference only, so owned-publication and clean-download gates are not applicable. The three owned artifacts are public on Hugging Face at pinned revisions and have verified clean download, boot, and models/text/strict-JSON/tool/vision smoke evidence. GHCR is not required because the final cards provide reproducible vLLM commands against the pinned upstream/local environment. The cards are final and reference planned immutable tag darkstar-qwen3.8-27b-v1.0.0. Tag darkstar-qwen3.8-27b-v1.0.0 has been cut; every applicable gate is verified and every product is published.",
  "any_publication_claim": true,
  "products": [
    {
      "product_id": "Darkstar-Qwen3.8-27B-Base-BF16",
      "role": "base-bf16",
      "lifecycle": "published",
      "target_repository": "Qwen/Qwen3.8-27B",
      "target_repository_status": "resolved",
      "target_repository_note": "Upstream reference only. Qwen/Qwen3.8-27B at revision 1d4bf0f2ff6012fd82039f2fa52739d0dd7c60c0 supplies the unchanged BF16 control; HangGlidersRule does not own or republish these weights and has no Base-BF16 repository.",
      "served_model_alias": "darkstar-qwen38-base-bf16",
      "runtime_container_name": "vllm-darkstar-qwen38-base-bf16",
      "model_card": "models/qwen3.8-27b-r3/model-card/base-bf16.md",
      "recipe": "recipes/qwen3.8-27b/darkstar-qwen3.8-27b-base-bf16.yaml",
      "publication_claim": true,
      "gates": [
        {
          "id": "provenance_ownership",
          "status": "verified",
          "evidence": "Source pinned to Qwen/Qwen3.8-27B@1d4bf0f...; upstream ownership and unchanged-reference status recorded; no HangGlidersRule weight repository exists or is planned",
          "evidence_path": "models/qwen3.8-27b-r3/artifact-lineage.md",
          "next_missing_proof": "none \u2014 gate satisfied"
        },
        {
          "id": "artifact_manifest",
          "status": "verified",
          "evidence": "Exact per-file SHA-256 manifest committed for the local artifact",
          "evidence_path": "models/qwen3.8-27b-r3/results/manifests/base-bf16-manifest.sha256",
          "next_missing_proof": "none \u2014 gate satisfied"
        },
        {
          "id": "recipe_edit_manifest",
          "status": "verified",
          "evidence": "Pinned Base BF16 recipe present and hashable (clean source, no transform, no quantization)",
          "evidence_path": "recipes/qwen3.8-27b/darkstar-qwen3.8-27b-base-bf16.yaml",
          "next_missing_proof": "none \u2014 gate satisfied"
        },
        {
          "id": "artifact_validation",
          "status": "verified",
          "evidence": "Structural validation passed; tokenizer/processor/chat/generation config preserved; 333 vision and 15 MTP tensors intact; recorded in the runtime snapshot",
          "evidence_path": "models/qwen3.8-27b-r3/results/serving-runtime-snapshots.json",
          "next_missing_proof": "none \u2014 gate satisfied"
        },
        {
          "id": "abliteration_pass",
          "status": "not_applicable",
          "evidence": "Clean base, no refusal-direction edit",
          "evidence_path": null,
          "next_missing_proof": "none"
        },
        {
          "id": "modelopt_candidate_comparison",
          "status": "not_applicable",
          "evidence": "BF16 product, not quantized",
          "evidence_path": null,
          "next_missing_proof": "none"
        },
        {
          "id": "nvfp4_tensor_scale_validation",
          "status": "not_applicable",
          "evidence": "BF16 product, no NVFP4 scales",
          "evidence_path": null,
          "next_missing_proof": "none"
        },
        {
          "id": "performance_profile",
          "status": "verified",
          "evidence": "Independent single-stream sweep: winner 130.158 tok/s at MTP8, FlashAttention, 64K scheduler budget, max-num-seqs 16, context 126144, BF16 KV",
          "evidence_path": "models/qwen3.8-27b-r3/results/performance-base-bf16.json",
          "next_missing_proof": "none \u2014 gate satisfied"
        },
        {
          "id": "serving_capacity_profile",
          "status": "verified",
          "evidence": "Measured matched serving-capacity profile committed with concurrency-separated aggregate throughput and zero fatal markers",
          "evidence_path": "models/qwen3.8-27b-r3/results/serving-capacity-profiles.json",
          "next_missing_proof": "none \u2014 gate satisfied"
        },
        {
          "id": "gpqa_matched_full_denominator",
          "status": "verified",
          "evidence": "157/198 = 79.29% full denominator, 198/198 terminal parseable, 0 timeouts, 0 parse errors, 0 errors, thinking off",
          "evidence_path": "models/qwen3.8-27b-r3/results/gpqa-base-bf16.json",
          "next_missing_proof": "none \u2014 gate satisfied"
        },
        {
          "id": "behavior_refusal_eval",
          "status": "not_applicable",
          "evidence": "Clean product; fresh abliteration behavior evaluation applies only to abliterated products",
          "evidence_path": null,
          "next_missing_proof": "none"
        },
        {
          "id": "serve_profile_frozen",
          "status": "verified",
          "evidence": "Frozen serve profile: vLLM compiled mode, FlashAttention, BF16 KV, context 126144, MTP depth 8, 64K scheduler budget, max-num-seqs 16",
          "evidence_path": "models/qwen3.8-27b-r3/model-card/base-bf16.md",
          "next_missing_proof": "none \u2014 gate satisfied"
        },
        {
          "id": "model_card_final",
          "status": "verified",
          "evidence": "Final model card is complete and references planned immutable release tag darkstar-qwen3.8-27b-v1.0.0; no placeholders remain",
          "evidence_path": "models/qwen3.8-27b-r3/model-card/base-bf16.md",
          "next_missing_proof": "none \u2014 gate satisfied"
        },
        {
          "id": "publication_targets_hf_ghcr",
          "status": "not_applicable",
          "evidence": "Unchanged upstream-only control: no owned Hugging Face or GHCR publication target exists",
          "evidence_path": null,
          "next_missing_proof": "none"
        },
        {
          "id": "clean_download_boot_smoke",
          "status": "not_applicable",
          "evidence": "No owned checkpoint is published or re-downloaded for the upstream-only control",
          "evidence_path": null,
          "next_missing_proof": "none"
        },
        {
          "id": "release_tag",
          "status": "verified",
          "evidence": "Immutable Git release tag darkstar-qwen3.8-27b-v1.0.0 exists and is referenced from the final model card",
          "evidence_path": "models/qwen3.8-27b-r3/model-card/base-bf16.md",
          "next_missing_proof": "none \u2014 gate satisfied"
        },
        {
          "id": "no_inherited_unverified_results",
          "status": "verified",
          "evidence": "GPQA and throughput are exact-artifact evidence; no behavior result is inherited from another artifact",
          "evidence_path": null,
          "next_missing_proof": "none \u2014 gate satisfied"
        }
      ]
    },
    {
      "product_id": "Darkstar-Qwen3.8-27B-Base-ModelOpt-NVFP4",
      "role": "base-modelopt-nvfp4",
      "lifecycle": "published",
      "target_repository": "HangGlidersRule/Darkstar-Qwen3.8-27B-Base-ModelOpt-W4A16-NVFP4-Mixed-FP8",
      "target_repository_status": "resolved",
      "target_repository_note": "Resolved to the selected mixed W4A16-NVFP4+FP8 candidate, whose id encodes its real precision class (W4A16 NVFP4 on language MLP + lm_head, FP8 on self-attention and GDN projections). The mixed candidate is the promoted Base ModelOpt release product; the uniform W4A4 candidate was built, measured, and rejected on throughput.",
      "served_model_alias": "darkstar-qwen38-base-nvfp4",
      "runtime_container_name": "vllm-darkstar-qwen38-base-modelopt",
      "model_card": "models/qwen3.8-27b-r3/model-card/base-nvfp4.md",
      "recipe": "recipes/qwen3.8-27b/darkstar-qwen3.8-27b-base-modelopt-nvfp4.yaml",
      "publication_claim": true,
      "candidates": [
        {
          "candidate_id": "Darkstar-Qwen3.8-27B-Base-ModelOpt-W4A16-NVFP4-Mixed-FP8",
          "precision_class": "W4A16-NVFP4-Mixed-FP8",
          "target_repository": "HangGlidersRule/Darkstar-Qwen3.8-27B-Base-ModelOpt-W4A16-NVFP4-Mixed-FP8",
          "selection": "selected",
          "promotion_status": "promoted",
          "promotion_note": "Selected as the Base ModelOpt release product. It is the single-stream throughput winner at 203.636 tok/s (MTP4, 32K scheduler budget) and its GPQA (153/198 = 77.27%) is within about 2.02 percentage points / 4 questions of the Base BF16 baseline (157/198 = 79.29%). The uniform W4A4 candidate was built and rejected at 129.441 tok/s. Quantizes lm_head in W4A16 NVFP4.",
          "recipe": "configs/modelopt/recipes/w4a16_nvfp4_mse-fp8_attn-kv_bf16.yaml",
          "evidence_path": "models/qwen3.8-27b-r3/results/gpqa-base-modelopt-w4a16-nvfp4-mixed-fp8.json",
          "immutable_hashes": {
            "summary_sha256": "fcff97b37e79cc12d71c9f4ddf0d9b6d4c54e57cb5434451243a432fb5630f65",
            "journal_sha256": "a436ce07f121d5fccceadddf217a5f3a8d5009d82f6b357be3b3eb3c1b017beb",
            "artifact_success_sha256": "1ad8da721a95e3f12428a22b3f91f67f213dfc197724dcf21630fbb82a8fb8a9",
            "recipe_sha256": "90fc6b37c00334debd49f1975ab406b5e20667f07e4be0be3e463a648abac642",